<?xml version="1.0" encoding="utf-8" ?>
<!-- Copyright (C) 2012-2013 The Android Open Source Project
     Copyright (C) 2012-2016 The Linux Foundation. All rights reserved.
     Not a contribution.

     Licensed under the Apache License, Version 2.0 (the "License");
     you may not use this file except in compliance with the License.
     You may obtain a copy of the License at

          http://www.apache.org/licenses/LICENSE-2.0

     Unless required by applicable law or agreed to in writing, software
     distributed under the License is distributed on an "AS IS" BASIS,
     WITHOUT WARRANTIES OR CONDITIONS OF ANY KIND, either express or implied.
     See the License for the specific language governing permissions and
     limitations under the License.
-->

<!--
<!DOCTYPE MediaCodecs [
<!ELEMENT Include EMPTY>
<!ATTLIST Include href CDATA #REQUIRED>
<!ELEMENT MediaCodecs (Decoders|Encoders|Include)*>
<!ELEMENT Decoders (MediaCodec|Include)*>
<!ELEMENT Encoders (MediaCodec|Include)*>
<!ELEMENT MediaCodec (Type|Quirk|Include)*>
<!ATTLIST MediaCodec name CDATA #REQUIRED>
<!ATTLIST MediaCodec type CDATA>
<!ELEMENT Type EMPTY>
<!ATTLIST Type name CDATA #REQUIRED>
<!ELEMENT Quirk EMPTY>
<!ATTLIST Quirk name CDATA #REQUIRED>
]>

There's a simple and a complex syntax to declare the availability of a
media codec:

A codec that properly follows the OpenMax spec and therefore doesn't have any
quirks and that only supports a single content type can be declared like so:

    <MediaCodec name="OMX.foo.bar" type="something/interesting" />

If a codec has quirks OR supports multiple content types, the following syntax
can be used:

    <MediaCodec name="OMX.foo.bar" >
        <Type name="something/interesting" />
        <Type name="something/else" />
        ...
        <Quirk name="requires-allocate-on-input-ports" />
        <Quirk name="requires-allocate-on-output-ports" />
        <Quirk name="output-buffers-are-unreadable" />
    </MediaCodec>

Only the three quirks included above are recognized at this point:

"requires-allocate-on-input-ports"
    must be advertised if the component does not properly support specification
    of input buffers using the OMX_UseBuffer(...) API but instead requires
    OMX_AllocateBuffer to be used.

"requires-allocate-on-output-ports"
    must be advertised if the component does not properly support specification
    of output buffers using the OMX_UseBuffer(...) API but instead requires
    OMX_AllocateBuffer to be used.

"output-buffers-are-unreadable"
    must be advertised if the emitted output buffers of a decoder component
    are not readable, i.e. use a custom format even though abusing one of
    the official OMX colorspace constants.
    Clients of such decoders will not be able to access the decoded data,
    naturally making the component much less useful. The only use for
    a component with this quirk is to render the output to the screen.
    Audio decoders MUST NOT advertise this quirk.
    Video decoders that advertise this quirk must be accompanied by a
    corresponding color space converter for thumbnail extraction,
    matching surfaceflinger support that can render the custom format to
    a texture and possibly other code, so just DON'T USE THIS QUIRK.


-->

<!--
  Decoder capabilities for msm8953
   __________ _________________________________________
  | Codec    | W       H       fps     Mbps    MB/s    |
  |__________|_________________________________________|
  | hevc     | 1920    1088    60       60     489600  |
  | h264     | 1920    1088    60       60     489600  |
  | h263     |  864     480    30        2      48600  |
  | mpeg4    | 1920    1088    60       60     489600  |
  | mpeg2    | 1920    1088    30       40     244800  |
  | vc1      | 1920    1088    60       60     489600  |
  | vp8      | 1920    1088    60       60     489600  |
  | vp9      | 1920    1088    60       60     489600  |
  | divx3    |  720     480    30        2      40500  |
  | div4/5/6 | 1920    1088    30       10     244800  |
  |__________|_________________________________________|

  Secure decoder capabilities for msm8953
   __________ _________________________________________
  | Codec    | W       H       fps     Mbps    MB/s    |
  |__________|_________________________________________|
  | hevc     | 1920    1088    60       60     489600  |
  | h264     | 1920    1088    60       60     489600  |
  | mpeg2    | 1920    1088    30       40     244800  |
  | vc1      | 1920    1088    60       60     489600  |
  |__________|_________________________________________|
-->

<!--
  Encoder capabilities for msm8953
   ____________________________________________________
  | Codec    | W       H       fps     Mbps    MB/s    |
  |__________|_________________________________________|
  | hevc     | 1920    1088    60       40     489600  |
  | h264     | 1920    1088    60       40     489600  |
  | h263     |  864     480    30        2      48600  |
  | mpeg4    | 1920    1088    30       40     244800  |
  | vp8      | 1920    1088    60       40     489600  |
  |____________________________________________________|
-->

<MediaCodecs>
    <Include href="media_codecs_google_audio.xml" />
    <Include href="media_codecs_google_telephony.xml" />
    <Settings>
        <Setting name="max-video-encoder-input-buffers" value="11" />
    </Settings>
    <Encoders>
        <!-- Video Hardware  -->
        <MediaCodec name="OMX.qcom.video.encoder.hevc" type="video/hevc" >
            <Quirk name="requires-allocate-on-input-ports" />
            <Quirk name="requires-allocate-on-output-ports" />
            <Quirk name="requires-loaded-to-idle-after-allocation" />
            <Limit name="size" min="176x64" max="1920x1088" />
            <Limit name="alignment" value="2x2" />
            <Limit name="block-size" value="16x16" />
            <Limit name="blocks-per-second" min="1" max="489600" />
            <Limit name="bitrate" range="1-40000000" />
            <Limit name="concurrent-instances" max="16" />
            <Feature name="intra-refresh" />
            <Limit name="performance-point-1920x1088" value="30" />
        </MediaCodec>
        <MediaCodec name="OMX.qcom.video.encoder.avc" type="video/avc" >
            <Quirk name="requires-allocate-on-input-ports" />
            <Quirk name="requires-allocate-on-output-ports" />
            <Quirk name="requires-loaded-to-idle-after-allocation" />
            <Limit name="size" min="96x64" max="1920x1088" />
            <Limit name="alignment" value="2x2" />
            <Limit name="block-size" value="16x16" />
            <Limit name="blocks-per-second" min="1" max="489600" />
            <Limit name="bitrate" range="1-40000000" />
            <Limit name="concurrent-instances" max="16" />
            <Feature name="intra-refresh" />
            <Limit name="performance-point-1920x1088" value="30" />
        </MediaCodec>
        <MediaCodec name="OMX.qcom.video.encoder.mpeg4" type="video/mp4v-es" >
            <Quirk name="requires-allocate-on-input-ports" />
            <Quirk name="requires-allocate-on-output-ports" />
            <Quirk name="requires-loaded-to-idle-after-allocation" />
            <Limit name="size" min="96x64" max="1920x1088" />
            <Limit name="alignment" value="2x2" />
            <Limit name="block-size" value="16x16" />
            <Limit name="blocks-per-second" min="1" max="244800" />
            <Limit name="bitrate" range="1-40000000" />
            <Limit name="concurrent-instances" max="16" />
            <Limit name="performance-point-1920x1088" value="30" />
        </MediaCodec>
        <MediaCodec name="OMX.qcom.video.encoder.h263" type="video/3gpp" >
            <Quirk name="requires-allocate-on-input-ports" />
            <Quirk name="requires-allocate-on-output-ports" />
            <Quirk name="requires-loaded-to-idle-after-allocation" />
            <Limit name="size" min="96x64" max="864x480" />
            <Limit name="alignment" value="2x2" />
            <Limit name="block-size" value="16x16" />
            <Limit name="blocks-per-second" min="1" max="48600" />
            <Limit name="bitrate" range="1-2000000" />
            <Limit name="concurrent-instances" max="16" />
            <Limit name="performance-point-720x480" value="30" />
        </MediaCodec>
        <MediaCodec name="OMX.qcom.video.encoder.vp8" type="video/x-vnd.on2.vp8" >
            <Quirk name="requires-allocate-on-input-ports" />
            <Quirk name="requires-allocate-on-output-ports" />
            <Quirk name="requires-loaded-to-idle-after-allocation" />
            <Limit name="size" min="96x64" max="1920x1088" />
            <Limit name="alignment" value="2x2" />
            <Limit name="block-size" value="16x16" />
            <Limit name="blocks-per-second" min="1" max="489600" />
            <Limit name="bitrate" range="1-40000000" />
            <Limit name="concurrent-instances" max="16" />
            <Feature name="intra-refresh" />
            <Limit name="performance-point-1920x1088" value="30" />
        </MediaCodec>
    </Encoders>
    <Decoders>
        <!-- Video Hardware  -->
        <MediaCodec name="OMX.qcom.video.decoder.mpeg2" type="video/mpeg2" >
            <Quirk name="requires-allocate-on-input-ports" />
            <Quirk name="requires-allocate-on-output-ports" />
            <Limit name="size" min="64x64" max="1920x1088" />
            <Limit name="alignment" value="2x2" />
            <Limit name="block-size" value="16x16" />
            <Limit name="blocks-per-second" min="1" max="244800" />
            <Limit name="bitrate" range="1-40000000" />
            <Feature name="adaptive-playback" />
            <Limit name="concurrent-instances" max="16" />
            <Limit name="performance-point-1920x1088" value="30" />
        </MediaCodec>
        <MediaCodec name="OMX.qcom.video.decoder.mpeg2.secure" type="video/mpeg2" >
            <Quirk name="requires-allocate-on-input-ports" />
            <Quirk name="requires-allocate-on-output-ports" />
            <Limit name="size" min="64x64" max="1920x1088" />
            <Limit name="alignment" value="2x2" />
            <Limit name="block-size" value="16x16" />
            <Limit name="blocks-per-second" min="1" max="244800" />
            <Limit name="bitrate" range="1-20000000" />
            <Feature name="adaptive-playback" />
            <Feature name="secure-playback" required="true" />
            <Limit name="concurrent-instances" max="10" />
            <Limit name="performance-point-1920x1088" value="30" />
        </MediaCodec>
        <MediaCodec name="OMX.qcom.video.decoder.mpeg4" type="video/mp4v-es" >
            <Quirk name="requires-allocate-on-input-ports" />
            <Quirk name="requires-allocate-on-output-ports" />
            <Limit name="size" min="64x64" max="1920x1088" />
            <Limit name="alignment" value="2x2" />
            <Limit name="block-size" value="16x16" />
            <Limit name="blocks-per-second" min="1" max="489600" />
            <Limit name="bitrate" range="1-60000000" />
            <Feature name="adaptive-playback" />
            <Limit name="concurrent-instances" max="16" />
            <Limit name="performance-point-1920x1088" value="30" />
        </MediaCodec>
        <MediaCodec name="OMX.qcom.video.decoder.h263" type="video/3gpp" >
            <Quirk name="requires-allocate-on-input-ports" />
            <Quirk name="requires-allocate-on-output-ports" />
            <Limit name="size" min="64x64" max="864x480" />
            <Limit name="alignment" value="2x2" />
            <Limit name="block-size" value="16x16" />
            <Limit name="blocks-per-second" min="1" max="48600" />
            <Limit name="bitrate" range="1-2000000" />
            <Feature name="adaptive-playback" />
            <Limit name="concurrent-instances" max="16" />
            <Limit name="performance-point-720x480" value="30" />
        </MediaCodec>
        <MediaCodec name="OMX.qcom.video.decoder.wmv" type="video/x-ms-wmv" >
            <Quirk name="requires-allocate-on-input-ports" />
            <Quirk name="requires-allocate-on-output-ports" />
            <Limit name="size" min="64x64" max="1920x1088" />
            <Limit name="alignment" value="2x2" />
            <Limit name="block-size" value="16x16" />
            <Limit name="blocks-per-second" min="1" max="489600" />
            <Limit name="bitrate" range="1-60000000" />
            <Feature name="adaptive-playback" />
            <Limit name="concurrent-instances" max="16" />
            <Limit name="performance-point-1920x1088" value="30" />
        </MediaCodec>
        <MediaCodec name="OMX.qcom.video.decoder.vc1" type="video/x-ms-wmv" >
            <Quirk name="requires-allocate-on-input-ports" />
            <Quirk name="requires-allocate-on-output-ports" />
            <Limit name="size" min="64x64" max="1920x1088" />
            <Limit name="alignment" value="2x2" />
            <Limit name="block-size" value="16x16" />
            <Limit name="blocks-per-second" min="1" max="489600" />
            <Limit name="bitrate" range="1-60000000" />
            <Feature name="adaptive-playback" />
            <Limit name="concurrent-instances" max="16" />
            <Limit name="performance-point-1920x1088" value="30" />
        </MediaCodec>
        <MediaCodec name="OMX.qcom.video.decoder.vc1.secure" type="video/x-ms-wmv" >
            <Quirk name="requires-allocate-on-input-ports" />
            <Quirk name="requires-allocate-on-output-ports" />
            <Limit name="size" min="64x64" max="1920x1088" />
            <Limit name="alignment" value="2x2" />
            <Limit name="block-size" value="16x16" />
            <Limit name="blocks-per-second" min="1" max="244800" />
            <Limit name="bitrate" range="1-20000000" />
            <Feature name="adaptive-playback" />
            <Feature name="secure-playback" required="true" />
            <Limit name="concurrent-instances" max="7" />
            <Limit name="performance-point-1920x1088" value="30" />
        </MediaCodec>
        <MediaCodec name="OMX.qcom.video.decoder.divx" type="video/divx" >
            <Quirk name="requires-allocate-on-input-ports" />
            <Quirk name="requires-allocate-on-output-ports" />
            <Limit name="size" min="64x64" max="1920x1088" />
            <Limit name="alignment" value="2x2" />
            <Limit name="block-size" value="16x16" />
            <Limit name="blocks-per-second" min="1" max="244800" />
            <Limit name="bitrate" range="1-10000000" />
            <Feature name="adaptive-playback" />
            <Limit name="concurrent-instances" max="16" />
            <Limit name="performance-point-1920x1088" value="30" />
        </MediaCodec>
        <MediaCodec name="OMX.qcom.video.decoder.divx311" type="video/divx311" >
            <Quirk name="requires-allocate-on-input-ports" />
            <Quirk name="requires-allocate-on-output-ports" />
            <Limit name="size" min="64x64" max="720x480" />
            <Limit name="alignment" value="2x2" />
            <Limit name="block-size" value="16x16" />
            <Limit name="blocks-per-second" min="1" max="40500" />
            <Limit name="bitrate" range="1-2000000" />
            <Feature name="adaptive-playback" />
            <Limit name="concurrent-instances" max="16" />
            <Limit name="performance-point-720x480" value="30" />
        </MediaCodec>
        <MediaCodec name="OMX.qcom.video.decoder.divx4" type="video/divx4" >
            <Quirk name="requires-allocate-on-input-ports" />
            <Quirk name="requires-allocate-on-output-ports" />
            <Limit name="size" min="64x64" max="1920x1088" />
            <Limit name="alignment" value="2x2" />
            <Limit name="block-size" value="16x16" />
            <Limit name="blocks-per-second" min="1" max="244800" />
            <Limit name="bitrate" range="1-10000000" />
            <Feature name="adaptive-playback" />
            <Limit name="concurrent-instances" max="16" />
            <Limit name="performance-point-1920x1088" value="30" />
        </MediaCodec>
        <MediaCodec name="OMX.qcom.video.decoder.vp8" type="video/x-vnd.on2.vp8" >
            <Quirk name="requires-allocate-on-input-ports" />
            <Quirk name="requires-allocate-on-output-ports" />
            <Limit name="size" min="64x64" max="1920x1088" />
            <Limit name="alignment" value="2x2" />
            <Limit name="block-size" value="16x16" />
            <Limit name="blocks-per-second" min="1" max="489600" />
            <Limit name="bitrate" range="1-60000000" />
            <Feature name="adaptive-playback" />
            <Limit name="concurrent-instances" max="16" />
            <Limit name="performance-point-1920x1088" value="30" />
        </MediaCodec>
        <MediaCodec name="OMX.qcom.video.decoder.vp9" type="video/x-vnd.on2.vp9" >
            <Quirk name="requires-allocate-on-input-ports" />
            <Quirk name="requires-allocate-on-output-ports" />
            <Limit name="size" min="64x64" max="3840x2160" />
            <Limit name="alignment" value="2x2" />
            <Limit name="block-size" value="16x16" />
            <Limit name="blocks-per-second" min="1" max="972000" />
            <Limit name="bitrate" range="1-100000000" />
            <Feature name="adaptive-playback" />
            <Limit name="concurrent-instances" max="16" />
            <Limit name="performance-point-3840x2160" value="24" />
        </MediaCodec>
        <MediaCodec name="OMX.qcom.video.decoder.hevc" type="video/hevc" >
            <Quirk name="requires-allocate-on-input-ports" />
            <Quirk name="requires-allocate-on-output-ports" />
            <Limit name="size" min="64x64" max="1920x1088" />
            <Limit name="alignment" value="2x2" />
            <Limit name="block-size" value="16x16" />
            <Limit name="blocks-per-second" min="1" max="489600" />
            <Limit name="bitrate" range="1-60000000" />
            <Feature name="adaptive-playback" />
            <Limit name="concurrent-instances" max="16" />
            <Limit name="performance-point-1920x1088" value="30" />
        </MediaCodec>
        <MediaCodec name="OMX.qcom.video.decoder.hevc.secure" type="video/hevc" >
            <Quirk name="requires-allocate-on-input-ports" />
            <Quirk name="requires-allocate-on-output-ports" />
            <Limit name="size" min="64x64" max="1920x1088" />
            <Limit name="alignment" value="2x2" />
            <Limit name="block-size" value="16x16" />
            <Limit name="blocks-per-second" min="1" max="244800" />
            <Limit name="bitrate" range="1-20000000" />
            <Feature name="adaptive-playback" />
            <Feature name="secure-playback" required="true" />
            <Limit name="concurrent-instances" max="5" />
            <Limit name="performance-point-1920x1088" value="30" />
        </MediaCodec>
        <MediaCodec name="c2.android.hevc.decoder" type="video/hevc" update="true">
            <!-- profiles and levels:  ProfileMain : MainTierLevel51 -->
            <Limit name="size" min="2x2" max="2048x2048" />
            <Limit name="alignment" value="2x2" />
            <Limit name="block-size" value="8x8" />
            <Limit name="block-count" range="1-65536" />
            <Limit name="blocks-per-second" range="1-491520" />
            <Limit name="bitrate" range="1-5000000" />
        </MediaCodec>
        <MediaCodec name="c2.android.avc.decoder" type="video/avc" update="true">
            <!-- profiles and levels:  ProfileHigh : Level51 -->
            <Limit name="size" min="2x2" max="2048x2048" />
            <Limit name="alignment" value="2x2" />
            <Limit name="block-size" value="16x16" />
            <Limit name="block-count" range="1-16384" />
            <Limit name="blocks-per-second" range="1-491520" />
            <Limit name="bitrate" range="1-40000000" />
            <Feature name="adaptive-playback" />
        </MediaCodec>
    </Decoders>
    <Include href="media_codecs_google_video_le.xml" />
</MediaCodecs>
